{
  "version": 1,
  "plugins": {
    "namespaces": true,
    "landlock": true,
    "seccomp": true
  },
  "defaults": {
    "fs": "deny",
    "net": "deny",
    "exec": "deny"
  },
  "net": {
    "rules": [
      {
        "action": "warn",
        "proto": "tcp",
        "cidr": "93.184.216.34/32",
        "ports": "80"
      }
    ]
  }
}
